{"count":1,"next":null,"previous":null,"results":[{"id":37360,"game_id":6237,"game_slug":"battlenet","name":"Blizzard Battle.net","year":1996,"user":"GloriousEggroll","runner":"wine","slug":"blizzard-battlenet-standard","version":"Standard","description":"Blizzard Battle.net","notes":"Instructions for proper functionality of Battle.Net (+ common problems)\r\nhttps://github.com/lutris/docs/blob/master/Battle.Net.md","credits":"","created_at":"2023-05-06T05:22:21.324687Z","updated_at":"2023-12-12T02:16:19.049979Z","draft":false,"published":true,"published_by":1,"rating":"","is_playable":null,"steamid":null,"gogid":null,"gogslug":"","humbleid":"","humblestoreid":"","humblestoreid_real":"","script":{"files":[{"setup":{"filename":"Battle.net-Setup.exe","url":"https://www.battle.net/download/getInstallerForGame?os=win&version=LIVE&gameProgram=BATTLENET_APP"}}],"game":{"arch":"win64","exe":"drive_c/Program Files (x86)/Battle.net/Battle.net Launcher.exe","prefix":"$GAMEDIR"},"installer":[{"task":{"arch":"win64","description":"Creating 64bit Wine prefix.","name":"create_prefix","prefix":"$GAMEDIR"}},{"task":{"app":"arial","arch":"win64","description":"Installing Arial font","name":"winetricks","prefix":"$GAMEDIR"}},{"task":{"app":"tahoma","arch":"win64","description":"Installing Tahoma font","name":"winetricks","prefix":"$GAMEDIR"}},{"task":{"arch":"win64","description":"Setting Windows 10 mode for Wine","key":"Version","name":"set_regedit","path":"HKEY_CURRENT_USER\\Software\\Wine","prefix":"$GAMEDIR","value":"win10"}},{"task":{"arch":"win64","description":"Wine Staging: Enabling DXVA2","key":"backend","name":"set_regedit","path":"HKEY_CURRENT_USER\\Software\\Wine\\DXVA2","prefix":"$GAMEDIR","value":"va"}},{"task":{"arch":"win64","description":"needed for Warcraft III Reforged","key":"version","name":"set_regedit","path":"HKEY_CURRENT_USER\\Software\\Wine\\AppDefaults\\BlizzardBrowser.exe","prefix":"$GAMEDIR","type":"REG_SZ","value":"win7"}},{"write_json":{"data":{"Client":{"GameLaunchWindowBehavior":"2","GameSearch":{"BackgroundSearch":"true"},"HardwareAcceleration":"false","Install":{"DownloadLimitNextPatchInBps":"0"},"Sound":{"Enabled":"false"},"Streaming":{"StreamingEnabled":"false"}},"Games":{"s2":{"AdditionalLaunchArguments":"-Displaymode 1"}}},"description":"Disabling Sound/Hardware Acceleration/Streaming in Blizzard App","file":"$GAMEDIR/drive_c/users/$USER/AppData/Roaming/Battle.net/Battle.net.config"}},{"merge":{"dst":"$GAMEDIR/drive_c/","src":"setup"}},{"execute":{"command":"WINEESYNC=1 WINEPREFIX=\"$GAMEDIR\" \"$WINEBIN\" \"$GAMEDIR/drive_c/Battle.net-Setup.exe\"","description":"Installing Blizzard App\n------------------------------\nDo not attempt to login to Battle.net, once Battle.net has finished installing and the login window appears, simply close it. You will log in the next time you start the app."}},{"task":{"name":"winekill","prefix":"$GAMEDIR"}}],"system":{"env":{"DXVK_HUD":"compiler","DXVK_STATE_CACHE_PATH":"$GAMEDIR","STAGING_SHARED_MEMORY":1,"__GL_SHADER_DISK_CACHE":1,"__GL_SHADER_DISK_CACHE_PATH":"$GAMEDIR","__GL_SHADER_DISK_CACHE_SKIP_CLEANUP":1},"exclude_processes":"Agent.exe \"Battle.net Helper.exe\""},"wine":{"battleye":false,"eac":false,"fsr":false,"overrides":{"locationapi":"d"}}},"content":"files:\n- setup:\n    filename: Battle.net-Setup.exe\n    url: https://www.battle.net/download/getInstallerForGame?os=win&version=LIVE&gameProgram=BATTLENET_APP\ngame:\n  arch: win64\n  exe: drive_c/Program Files (x86)/Battle.net/Battle.net Launcher.exe\n  prefix: $GAMEDIR\ninstaller:\n- task:\n    arch: win64\n    description: Creating 64bit Wine prefix.\n    name: create_prefix\n    prefix: $GAMEDIR\n- task:\n    app: arial\n    arch: win64\n    description: Installing Arial font\n    name: winetricks\n    prefix: $GAMEDIR\n- task:\n    app: tahoma\n    arch: win64\n    description: Installing Tahoma font\n    name: winetricks\n    prefix: $GAMEDIR\n- task:\n    arch: win64\n    description: Setting Windows 10 mode for Wine\n    key: Version\n    name: set_regedit\n    path: HKEY_CURRENT_USER\\Software\\Wine\n    prefix: $GAMEDIR\n    value: win10\n- task:\n    arch: win64\n    description: 'Wine Staging: Enabling DXVA2'\n    key: backend\n    name: set_regedit\n    path: HKEY_CURRENT_USER\\Software\\Wine\\DXVA2\n    prefix: $GAMEDIR\n    value: va\n- task:\n    arch: win64\n    description: needed for Warcraft III Reforged\n    key: version\n    name: set_regedit\n    path: HKEY_CURRENT_USER\\Software\\Wine\\AppDefaults\\BlizzardBrowser.exe\n    prefix: $GAMEDIR\n    type: REG_SZ\n    value: win7\n- write_json:\n    data:\n      Client:\n        GameLaunchWindowBehavior: '2'\n        GameSearch:\n          BackgroundSearch: 'true'\n        HardwareAcceleration: 'false'\n        Install:\n          DownloadLimitNextPatchInBps: '0'\n        Sound:\n          Enabled: 'false'\n        Streaming:\n          StreamingEnabled: 'false'\n      Games:\n        s2:\n          AdditionalLaunchArguments: -Displaymode 1\n    description: Disabling Sound/Hardware Acceleration/Streaming in Blizzard App\n    file: $GAMEDIR/drive_c/users/$USER/AppData/Roaming/Battle.net/Battle.net.config\n- merge:\n    dst: $GAMEDIR/drive_c/\n    src: setup\n- execute:\n    command: WINEESYNC=1 WINEPREFIX=\"$GAMEDIR\" \"$WINEBIN\" \"$GAMEDIR/drive_c/Battle.net-Setup.exe\"\n    description: 'Installing Blizzard App\n\n      ------------------------------\n\n      Do not attempt to login to Battle.net, once Battle.net has finished installing\n      and the login window appears, simply close it. You will log in the next time\n      you start the app.'\n- task:\n    name: winekill\n    prefix: $GAMEDIR\nsystem:\n  env:\n    DXVK_HUD: compiler\n    DXVK_STATE_CACHE_PATH: $GAMEDIR\n    STAGING_SHARED_MEMORY: 1\n    __GL_SHADER_DISK_CACHE: 1\n    __GL_SHADER_DISK_CACHE_PATH: $GAMEDIR\n    __GL_SHADER_DISK_CACHE_SKIP_CLEANUP: 1\n  exclude_processes: Agent.exe \"Battle.net Helper.exe\"\nwine:\n  battleye: false\n  eac: false\n  fsr: false\n  overrides:\n    locationapi: d\n","discord_id":null}]}